<?xml version="1.0" encoding="utf-8"?>
<?xml-stylesheet href="schema2xhtml.xsl" type="text/xsl"?>

<!-- Schema for JMRI decoder definitions       -->

<!-- $Id: decoder.xsd,v 1.3 2010-01-26 03:23:34 jacobsen Exp $ -->

<!-- This schema is part of JMRI. Copyright 2009, 2010.                     -->
<!--                                                                        -->
<!-- JMRI is free software; you can redistribute it and/or modify it under  -->
<!-- the terms of version 2 of the GNU General Public License as published  -->
<!-- by the Free Software Foundation. See the "COPYING" file for a copy     -->
<!-- of this license.                                                       -->
<!--                                                                        -->
<!-- JMRI is distributed in the hope that it will be useful, but WITHOUT    -->
<!-- ANY WARRANTY; without even the implied warranty of MERCHANTABILITY or  -->
<!-- FITNESS FOR A PARTICULAR PURPOSE.  See the GNU General Public License  -->
<!-- for more details.                                                      -->


    <!-- need variable -->
    <!-- need ivariable -->
    
    <!-- not yet in proper Venetian blind form -->
    <!-- needs to share the pane type with programmer definition -->
    
    <!-- need documentation, etc -->
    <!-- need attribute restrictions -->
    
<xs:schema xmlns:xs="http://www.w3.org/2001/XMLSchema"
           xmlns:xsi ="http://www.w3.org/2001/XMLSchema-instance"
           xmlns:docbook="http://docbook.org/ns/docbook"
           xmlns:jmri="http://jmri.org/xml/schema/JMRIschema"
           xsi:schemaLocation="
                http://jmri.org/xml/schema/JMRIschema http://jmri.org/xml/schema/JMRIschema.xsd
                http://docbook.org/ns/docbook http://jmri.org/xml/schema/docbook/DocBook.xsd
            "
           >

<xs:annotation>
    <xs:documentation>
      Defines the JMRI decoder definition files.
    </xs:documentation>
    <xs:appinfo>
        <jmri:usingclass configurexml="false">jmri.jmrit.decoderdefn.DecoderFile</jmri:usingclass>
        <jmri:usingclass configurexml="false">jmri.jmrit.symbolicprog.VariableTableModel</jmri:usingclass>
    </xs:appinfo>
</xs:annotation>

  <xs:element name="decoder-config">
    <xs:complexType>
      <xs:sequence>
        <xs:element name="version" type="VersionType" minOccurs="0" maxOccurs="unbounded" />
        <xs:element name="decoder" type="DecoderType" minOccurs="1" maxOccurs="1"/>
        <xs:element name="pane"    type="PaneType" minOccurs="0" maxOccurs="unbounded"/>
      </xs:sequence>
    </xs:complexType>
  </xs:element>

  <xs:complexType name="VersionType">
      <xs:attribute name="author" />
      <xs:attribute name="version" />
      <xs:attribute name="lastUpdated" />
  </xs:complexType>

  <xs:complexType name="DecoderType">
    <xs:sequence>

      <xs:element name="family" type="FamilyType" minOccurs="1" maxOccurs="1" />

      <xs:element name="programming" minOccurs="1" maxOccurs="1" >
        <xs:complexType>
          <xs:attribute name="direct" />
          <xs:attribute name="paged" />
          <xs:attribute name="register" />
          <xs:attribute name="ops" />
        </xs:complexType>
      </xs:element>

      <xs:element name="variables" type="VariablesType" minOccurs="1" maxOccurs="1" />

      <xs:element name="resets" type="ResetsType" minOccurs="0" maxOccurs="1"/>

    </xs:sequence>
  </xs:complexType>

  <xs:complexType name="FamilyType">
    <xs:sequence>

      <xs:element name="model" minOccurs="0" maxOccurs="unbounded" />

      <xs:element name="functionlabels" minOccurs="0" maxOccurs="1">
        <xs:complexType><xs:sequence>
          <xs:element name="functionlabel" minOccurs="0" maxOccurs="unbounded">
            <xs:complexType>
              <xs:simpleContent>
                <xs:extension base="xs:string">
                  <xs:attribute name="num" type="xs:string"/>
                  <xs:attribute name="lockable" type="xs:string"/>
                </xs:extension>
              </xs:simpleContent>
            </xs:complexType>
          </xs:element>
        </xs:sequence></xs:complexType>
      </xs:element>

    </xs:sequence>
    <xs:attribute name="name" />
    <xs:attribute name="mfg" />
    <xs:attribute name="lowVersionID" />
  </xs:complexType>

  <xs:complexType name="VariablesType">
    <xs:sequence minOccurs="0" maxOccurs="unbounded">
      <xs:element name="constant" minOccurs="0" maxOccurs="unbounded" />
      <xs:element name="variable" minOccurs="0" maxOccurs="unbounded" />
      <xs:element name="ivariable" minOccurs="0" maxOccurs="unbounded" />
    </xs:sequence>
  </xs:complexType>

  <xs:complexType name="ResetsType">
    <xs:sequence>
      <xs:element name="ifactReset" minOccurs="0" maxOccurs="unbounded" >
        <xs:complexType>
          <xs:attribute name="label" type="xs:string"/>
          <xs:attribute name="CVname" type="xs:string"/>
          <xs:attribute name="CV" type="xs:string"/>
          <xs:attribute name="PI" type="xs:string"/>
          <xs:attribute name="SI" type="xs:string"/>
          <xs:attribute name="default" type="xs:string"/>
          <xs:attribute name="item" type="xs:string"/>
        </xs:complexType>
      </xs:element>
    </xs:sequence>
  </xs:complexType>

  <xs:complexType name="PaneType">
    <xs:choice>
      <xs:element name="row" type="PaneRowType" minOccurs="0" maxOccurs="unbounded" />
      <xs:element name="column" type="PaneColumnType" minOccurs="0" maxOccurs="unbounded"/>
    </xs:choice>
    <xs:attribute name="name" type="xs:string"/>
  </xs:complexType>
  <xs:complexType name="PaneRowType">
    <xs:sequence minOccurs="1" maxOccurs="unbounded">
      <xs:element name="column" type="PaneColumnType" minOccurs="0" maxOccurs="unbounded" />
      <xs:element name="label" type="LabelType" minOccurs="0" maxOccurs="unbounded" />
      <xs:element name="display" type="DisplayType" minOccurs="0" maxOccurs="unbounded" />
      <xs:element name="separator" minOccurs="0" maxOccurs="unbounded" />
      <xs:element name="indxcvtable" minOccurs="0" maxOccurs="unbounded" />
    </xs:sequence>
  </xs:complexType>
  <xs:complexType name="PaneColumnType">
    <xs:sequence minOccurs="1" maxOccurs="unbounded">
      <xs:element name="row" type="PaneRowType" minOccurs="0" maxOccurs="unbounded" />
      <xs:element name="label" type="LabelType" minOccurs="0" maxOccurs="unbounded" />
      <xs:element name="display" type="DisplayType" minOccurs="0" maxOccurs="unbounded" />
      <xs:element name="separator" minOccurs="0" maxOccurs="unbounded" />
      <xs:element name="indxcvtable" minOccurs="0" maxOccurs="unbounded" />
    </xs:sequence>
  </xs:complexType>
  <xs:complexType name="LabelType">
    <xs:attribute name="label" type="xs:string"/>
  </xs:complexType>
  <xs:complexType name="DisplayType">
    <xs:attribute name="item" type="xs:string"/>
    <xs:attribute name="label" type="xs:string"/>
    <xs:attribute name="format" type="xs:string"/>
    <xs:attribute name="layout" type="xs:string"/>
    <xs:attribute name="tooltip" type="xs:string"/>
  </xs:complexType>


</xs:schema>
