<?xml version="1.0" encoding="utf-8"?>
<?xml-stylesheet type="text/xsl" href="../XSLT/decoder.xsl"?>
<!-- Copyright (C) JMRI 2005, 2007 All rights reserved -->
<!--                                                                        -->
<!-- JMRI is free software; you can redistribute it and/or modify it under  -->
<!-- the terms of version 2 of the GNU General Public License as published  -->
<!-- by the Free Software Foundation. See the "COPYING" file for a copy     -->
<!-- of this license.                                                       -->
<!--                                                                        -->
<!-- JMRI is distributed in the hope that it will be useful, but WITHOUT    -->
<!-- ANY WARRANTY; without even the implied warranty of MERCHANTABILITY or  -->
<!-- FITNESS FOR A PARTICULAR PURPOSE.  See the GNU General Public License  -->
<!-- for more details.                                                      -->
<!-- version 1 - new file panes for QSi V8 files -->
<pane name="Component Balance" xmlns:xi="http://www.w3.org/2001/XInclude" xmlns:xsi="http://www.w3.org/2001/XMLSchema-instance" xsi:noNamespaceSchemaLocation="http://jmri.org/xml/schema/decoder.xsd">
  <column>
    <row>
      <column>
        <label label="JMRI 2.13.2 or later is required for QSI V9"/>
        <label label="When programming in Ops-mode, see note on QSI Misc. tab"/>
        <label label=" "/>
        <display item="CV56.254.6"/>
        <label label=" "/>
      </column>
    </row>
    <row>
      <label label="Select the speaker and percent reduction of sound output for that speaker, other speaker remains at 100%"/>
    </row>
    <row>
      <column>
        <row>
          <column>
            <display item="CV128.10.0 Sign" format="onradiobutton" label="" layout="left"/>
            <display item="CV128.10.0 Sign" format="offradiobutton" label="" layout="left"/>
          </column>
          <column>
            <row>
              <display item="CV128.10.0 Value" layout="above" label=""/>
              <display item="CV128.10.0 Value" layout="above" format="hslider-percent"/>
            </row>
          </column>
        </row>
        <label label=" "/>
        <row>
          <column>
            <display item="CV128.10.10 Sign" format="onradiobutton" label="" layout="left"/>
            <display item="CV128.10.10 Sign" format="offradiobutton" label="" layout="left"/>
          </column>
          <column>
            <row>
              <display item="CV128.10.10 Value" layout="above" label=""/>
              <display item="CV128.10.10 Value" layout="above" format="hslider-percent"/>
            </row>
          </column>
        </row>
        <label label=" "/>
        <row>
          <column>
            <display item="CV128.10.20 Sign" format="onradiobutton" label="" layout="left"/>
            <display item="CV128.10.20 Sign" format="offradiobutton" label="" layout="left"/>
          </column>
          <column>
            <row>
              <display item="CV128.10.20 Value" layout="above" label=""/>
              <display item="CV128.10.20 Value" layout="above" format="hslider-percent"/>
            </row>
          </column>
        </row>
        <label label=" "/>
        <row>
          <column>
            <display item="CV128.10.30 Sign" format="onradiobutton" label="" layout="left"/>
            <display item="CV128.10.30 Sign" format="offradiobutton" label="" layout="left"/>
          </column>
          <column>
            <row>
              <display item="CV128.10.30 Value" layout="above" label=""/>
              <display item="CV128.10.30 Value" layout="above" format="hslider-percent"/>
            </row>
          </column>
        </row>
        <label label=" "/>
        <row>
          <column>
            <display item="CV128.10.60 Sign" format="onradiobutton" label="" layout="left"/>
            <display item="CV128.10.60 Sign" format="offradiobutton" label="" layout="left"/>
          </column>
          <column>
            <row>
              <display item="CV128.10.60 Value" layout="above" label=""/>
              <display item="CV128.10.60 Value" layout="above" format="hslider-percent"/>
            </row>
          </column>
        </row>
        <label label=" "/>
        <row>
          <column>
            <display item="CV128.10.70 Sign" format="onradiobutton" label="" layout="left"/>
            <display item="CV128.10.70 Sign" format="offradiobutton" label="" layout="left"/>
          </column>
          <column>
            <row>
              <display item="CV128.10.70 Value" layout="above" label=""/>
              <display item="CV128.10.70 Value" layout="above" format="hslider-percent"/>
            </row>
          </column>
        </row>
        <label label=" "/>
      </column>
      <column>
        <label label="        "/>
      </column>
      <column>
        <row>
          <column>
            <display item="CV128.11.0 Sign" format="onradiobutton" label="" layout="left"/>
            <display item="CV128.11.0 Sign" format="offradiobutton" label="" layout="left"/>
          </column>
          <column>
            <row>
              <display item="CV128.11.0 Value" layout="above" label=""/>
              <display item="CV128.11.0 Value" layout="above" format="hslider-percent"/>
            </row>
          </column>
        </row>
        <label label=" "/>
        <row>
          <column>
            <display item="CV128.11.10 Sign" format="onradiobutton" label="" layout="left"/>
            <display item="CV128.11.10 Sign" format="offradiobutton" label="" layout="left"/>
          </column>
          <column>
            <row>
              <display item="CV128.11.10 Value" layout="above" label=""/>
              <display item="CV128.11.10 Value" layout="above" format="hslider-percent"/>
            </row>
          </column>
        </row>
        <label label=" "/>
        <row>
          <column>
            <display item="CV128.11.20 Sign" format="onradiobutton" label="" layout="left"/>
            <display item="CV128.11.20 Sign" format="offradiobutton" label="" layout="left"/>
          </column>
          <column>
            <row>
              <display item="CV128.11.20 Value" layout="above" label=""/>
              <display item="CV128.11.20 Value" layout="above" format="hslider-percent"/>
            </row>
          </column>
        </row>
        <label label=" "/>
        <row>
          <column>
            <display item="CV128.11.30 Sign" format="onradiobutton" label="" layout="left"/>
            <display item="CV128.11.30 Sign" format="offradiobutton" label="" layout="left"/>
          </column>
          <column>
            <row>
              <display item="CV128.11.30 Value" layout="above" label=""/>
              <display item="CV128.11.30 Value" layout="above" format="hslider-percent"/>
            </row>
          </column>
        </row>
        <label label=" "/>
        <row>
          <column>
            <display item="CV128.11.60 Sign" format="onradiobutton" label="" layout="left"/>
            <display item="CV128.11.60 Sign" format="offradiobutton" label="" layout="left"/>
          </column>
          <column>
            <row>
              <display item="CV128.11.60 Value" layout="above" label=""/>
              <display item="CV128.11.60 Value" layout="above" format="hslider-percent"/>
            </row>
          </column>
        </row>
        <label label=" "/>
        <row>
          <column>
            <display item="CV128.11.70 Sign" format="onradiobutton" label="" layout="left"/>
            <display item="CV128.11.70 Sign" format="offradiobutton" label="" layout="left"/>
          </column>
          <column>
            <row>
              <display item="CV128.11.70 Value" layout="above" label=""/>
              <display item="CV128.11.70 Value" layout="above" format="hslider-percent"/>
            </row>
          </column>
        </row>
        <label label=" "/>
      </column>
    </row>
    <label label=" "/>
    <label label="Sets the relative volumes of the two speakers, adjust overall volume on the Volume tab"/>
    <label label="Please treat the 'Off' in the sliders as '0%' also slider is percent reduction of selected speaker"/>
    <label label="If silder is at 'Off' read as 0% reduction, ie both speakers are 100% of volume setting as set on Volume tab"/>
    <label label="If Speaker 1 selected and silder is at '50%', speaker 1 is half the volume as speaker 2 and speaker 2 is as set on Volume tab"/>
    <label label="If Speaker 2 selected and silder is at '100%', speaker 2 is silent and speaker 1 is as set on Volume tab"/>
  </column>
</pane>
